### ISSUE TITLE
Non-Functional network stack outside of localhost

### ISSUE THREAD

**Issue by Ozymandias42** [LizardByte/Sunshine#3079]
### Is there an existing issue for this?

- [X] I have searched the existing issues

### Is your issue described in the documentation?

- [X] I have read the documentation

### Is your issue present in the latest beta/pre-release?

I'm too lazy to test

### Context
- Sunshine broadcast domain A
- Moonlight in broadcast domain B
- Both are routed and NOT NAT'ed.
- No Firewall in-between.
- Log verbosity set to debug
- Ping, Traceroute and name-resolving works both ways.
- No Avahi and no UPnP installed and setup.

### Problematic functionality
No connection attempts even show up in sunshine no matter which ports are used.
#### Workarounds tried
- Hotspot to get Moonlight and Sunshine into a common broadcast domain C
- Connecting the server to broadcast domain B
- Setting up Port-Forwarding in the Router between broadcast domains A and B despite that not being needed.

---
Should this -as I'm starting to think, as at the very least a connection attempt should show up- rather be an issue with Moonlight, just close this issue. I'll be reopening it with Moonlight then.

Thanks.

### Expected Behavior

Enter IP of Sunshine in broadcast domain A in  Moonlight client in broadcast domain B. 
Hit Enter, get prompt for PIN. Enter PIN in Web-UI of Sunshine over in broadcast domain A. Enter PIN for Moonlight and confirm. Done. Client usable. 

### Additional Context

Connections do go through as shown via `sudo tcpdump -n 'dst port 47989 or 47984 or 47990 or 48010 or 47998'` run on the server
```
15:26:40.417539 IP 192.168.43.3.60802 > 192.168.30.162.47989: Flags [S], seq 1508818814, win 65535, options [mss 1240,nop,wscale 6,nop,nop,TS val 1262830061 ecr 0,sackOK,eol], length 0
15:26:41.418870 IP 192.168.43.3.60802 > 192.168.30.162.47989: Flags [S], seq 1508818814, win 65535, options [mss 1240,nop,wscale 6,nop,nop,TS val 1262831066 ecr 0,sackOK,eol], length 0
15:26:42.427119 IP 192.168.43.3.60802 > 192.168.30.162.47989: Flags [S], seq 1508818814, win 65535, options [mss 1240,nop,wscale 6,nop,nop,TS val 1262832069 ecr 0,sackOK,eol], length 0
15:26:43.431893 IP 192.168.43.3.60802 > 192.168.30.162.47989: Flags [S], seq 1508818814, win 65535, options [mss 1240,nop,wscale 6,nop,nop,TS val 1262833075 ecr 0,sackOK,eol], length 0
15:26:44.434907 IP 192.168.43.3.60802 > 192.168.30.162.47989: Flags [S], seq 1508818814, win 65535, options [mss 1240,nop,wscale 6,nop,nop,TS val 1262834077 ecr 0,sackOK,eol], length 0
```

### Host Operating System

Linux

### Operating System Version

NixOS Vikunia 24.11

### Architecture

64 bit

### Sunshine commit or version

0.23.1

### Package

Linux - nixpkgs (Third Party)

### GPU Type

Intel

### GPU Model

12th Gen ADL

### GPU Driver/Mesa Version

24.1.5

### Capture Method

KMX (Linux)

### Config

```Shell
#empty config. all defaults.
```

### Relevant log output

```shell
#No log output at all. Which is one of the problems.
```

**Comment by ReenigneArcher** [comment]
WAN is disabled by default: https://docs.lizardbyte.dev/projects/sunshine/en/latest/about/advanced_usage.html#origin-web-ui-allowed

This only affects the web UI though. Anything other than that is controlled by your firewall, router, etc.
