### ISSUE TITLE
Black screen on Arch linux after upgrade to kernel 7.0

### ISSUE THREAD

**Issue by paju1986** [LizardByte/Sunshine#5067]
### Is there an existing issue for this?

- [x] I have searched the existing issues

### Is your issue described in the documentation?

- [x] I have read the documentation

### Is your issue present in the latest beta/pre-release?

This issue is present in the latest pre-release

### Describe the Bug

After upgrading my arch linux to kernel 7.0 every time i connect to sunshine i get a black screen.
If i switch back to a 6.19 kernel or lower it works fine.
Im using kms capture on KDE with amd drivers
I'm using latest stable version of sunshine also tried with the beta with same result
here is full log:

[2026-05-01 17:40:45.197056] [0x00007f1ab96bac00] [info]    config: 'upnp' = enabled
[2026-05-01 17:40:45.197072] [0x00007f1ab96bac00] [info]    config: 'adapter_name' = /dev/dri/renderD128
[2026-05-01 17:40:45.197075] [0x00007f1ab96bac00] [info]    config: 'vk_rc_mode' = 4
[2026-05-01 17:40:45.197077] [0x00007f1ab96bac00] [info]    config: 'amd_quality' = default
[2026-05-01 17:40:45.197080] [0x00007f1ab96bac00] [info]    config: 'amd_rc' = auto
[2026-05-01 17:40:45.197081] [0x00007f1ab96bac00] [info]    config: 'encoder' = vaapi
[2026-05-01 17:40:45.197083] [0x00007f1ab96bac00] [info]    config: 'capture' = kms
[2026-05-01 17:40:45.197086] [0x00007f1ab96bac00] [info]    config: 'channels' = 2
[2026-05-01 17:40:45.197088] [0x00007f1ab96bac00] [info]    config: 'hevc_mode' = 2
[2026-05-01 17:40:45.197090] [0x00007f1ab96bac00] [info]    config: 'nv_rc' = auto
[2026-05-01 17:40:45.197092] [0x00007f1ab96bac00] [info]    config: 'fps' = [10,30,60,90,120,0]
[2026-05-01 17:40:45.197094] [0x00007f1ab96bac00] [info]    config: 'gamepad' = ds5
[2026-05-01 17:40:45.197096] [0x00007f1ab96bac00] [info]    config: 'output_name' = 0
[2026-05-01 17:40:45.197098] [0x00007f1ab96bac00] [info]    config: 'origin_pin_allowed' = lan
[2026-05-01 17:40:45.197100] [0x00007f1ab96bac00] [info]    config: 'resolutions' = [
    352x240,
    480x360,
    858x480,
    1280x720,
    1920x1080,
    2560x1080,
    3440x1440,
    1920x1200,
    3860x2160,
    3840x1600,
    0x0
]
Warning: Unrecognized configurable option [vk_rc_mode]
Warning: Unrecognized configurable option [channels]
Warning: Unrecognized configurable option [nv_rc]
Warning: Unrecognized configurable option [fps]
Warning: Unrecognized configurable option [origin_pin_allowed]
Warning: Unrecognized configurable option [resolutions]
[2026-05-01 17:40:45.197]: Info: Sunshine version: 2025.924.154138 commit: 86188d47a7463b0f73b35de18a628353adeaa20e
[2026-05-01 17:40:45.197]: Info: Package Publisher: LizardByte
[2026-05-01 17:40:45.197]: Info: Publisher Website: https://app.lizardbyte.dev
[2026-05-01 17:40:45.197]: Info: Get support: https://app.lizardbyte.dev/support
[2026-05-01 17:40:45.197]: Info: config: 'resolutions' = [
    352x240,
    480x360,
    858x480,
    1280x720,
    1920x1080,
    2560x1080,
    3440x1440,
    1920x1200,
    3860x2160,
    3840x1600,
    0x0
]
[2026-05-01 17:40:45.197]: Info: config: 'origin_pin_allowed' = lan
[2026-05-01 17:40:45.197]: Info: config: 'upnp' = enabled
[2026-05-01 17:40:45.197]: Info: config: 'adapter_name' = /dev/dri/renderD128
[2026-05-01 17:40:45.197]: Info: config: 'gamepad' = ds5
[2026-05-01 17:40:45.197]: Info: config: 'vk_rc_mode' = 4
[2026-05-01 17:40:45.197]: Info: config: 'amd_quality' = default
[2026-05-01 17:40:45.197]: Info: config: 'amd_rc' = auto
[2026-05-01 17:40:45.197]: Info: config: 'encoder' = vaapi
[2026-05-01 17:40:45.197]: Info: config: 'capture' = kms
[2026-05-01 17:40:45.197]: Info: config: 'channels' = 2
[2026-05-01 17:40:45.197]: Info: config: 'hevc_mode' = 2
[2026-05-01 17:40:45.197]: Info: config: 'nv_rc' = auto
[2026-05-01 17:40:45.197]: Info: config: 'fps' = [10,30,60,90,120,0]
[2026-05-01 17:40:45.197]: Info: config: 'output_name' = 0
[2026-05-01 17:40:45.197]: Info: /dev/dri/card2 -> amdgpu
[2026-05-01 17:40:45.198]: Info: /dev/dri/card1 -> amdgpu
[2026-05-01 17:40:45.202]: Info: Found display [wayland-0]
[2026-05-01 17:40:45.202]: Info: Found display [wayland-0]
[2026-05-01 17:40:45.203]: Info: Found interface: zxdg_output_manager_v1(31) version 3
[2026-05-01 17:40:45.203]: Info: Found interface: zwp_linux_dmabuf_v1(57) version 5
[2026-05-01 17:40:45.203]: Info: Found interface: wl_output(64) version 4
[2026-05-01 17:40:45.203]: Info: Resolution: 1920x1080
[2026-05-01 17:40:45.203]: Info: Offset: 0x0
[2026-05-01 17:40:45.203]: Info: Logical size: 1920x1080
[2026-05-01 17:40:45.203]: Info: Name: HDMI-A-1
[2026-05-01 17:40:45.203]: Info: Found monitor: Ancor Communications Inc VS278
[2026-05-01 17:40:45.203]: Info: -------- Start of KMS monitor list --------
[2026-05-01 17:40:45.203]: Info: Monitor 0 is HDMI-A-1: Ancor Communications Inc VS278
[2026-05-01 17:40:45.203]: Info: --------- End of KMS monitor list ---------
[2026-05-01 17:40:45.294]: Info: Trying encoder [vaapi]
[2026-05-01 17:40:45.294]: Info: Screencasting with KMS
[2026-05-01 17:40:45.294]: Info: /dev/dri/card2 -> amdgpu
[2026-05-01 17:40:45.294]: Info: Found monitor for DRM screencasting
[2026-05-01 17:40:45.294]: Info: Found connector ID [377]
[2026-05-01 17:40:45.294]: Info: Found cursor plane [360]
[2026-05-01 17:40:45.301]: Info: Creating encoder [h264_vaapi]
[2026-05-01 17:40:45.301]: Info: Color coding: SDR (Rec. 601)
[2026-05-01 17:40:45.301]: Info: Color depth: 8-bit
[2026-05-01 17:40:45.301]: Info: Color range: JPEG
[2026-05-01 17:40:45.312]: Info: vaapi vendor: Mesa Gallium driver 26.0.6-arch2.2 for AMD Ryzen 7 7800X3D 8-Core Processor (radeonsi, raphael_mendocino, ACO, DRM 3.64, 7.0.3-arch1-1)
[2026-05-01 17:40:45.312]: Info: Streaming bitrate is 1000000
[2026-05-01 17:40:45.312]: Info: Using normal encoding mode
[2026-05-01 17:40:45.312]: Info: Using default rate control
[2026-05-01 17:40:45.325]: Info: Creating encoder [hevc_vaapi]
[2026-05-01 17:40:45.325]: Info: Color coding: SDR (Rec. 601)
[2026-05-01 17:40:45.325]: Info: Color depth: 8-bit
[2026-05-01 17:40:45.325]: Info: Color range: JPEG
[2026-05-01 17:40:45.335]: Info: vaapi vendor: Mesa Gallium driver 26.0.6-arch2.2 for AMD Ryzen 7 7800X3D 8-Core Processor (radeonsi, raphael_mendocino, ACO, DRM 3.64, 7.0.3-arch1-1)
[2026-05-01 17:40:45.335]: Info: Streaming bitrate is 1000000
[2026-05-01 17:40:45.335]: Info: Using normal encoding mode
[2026-05-01 17:40:45.335]: Info: Using default rate control
[2026-05-01 17:40:45.347]: Info: Creating encoder [av1_vaapi]
[2026-05-01 17:40:45.347]: Info: Color coding: SDR (Rec. 601)
[2026-05-01 17:40:45.347]: Info: Color depth: 8-bit
[2026-05-01 17:40:45.347]: Info: Color range: JPEG
[2026-05-01 17:40:45.355]: Info: vaapi vendor: Mesa Gallium driver 26.0.6-arch2.2 for AMD Ryzen 7 7800X3D 8-Core Processor (radeonsi, raphael_mendocino, ACO, DRM 3.64, 7.0.3-arch1-1)
[2026-05-01 17:40:45.355]: Info: Streaming bitrate is 1000000
[2026-05-01 17:40:45.355]: Error: [av1_vaapi @ 0x7f1a9c0a1b40] No usable encoding entrypoint found for profile VAProfileAV1Profile0 (32).
[2026-05-01 17:40:45.355]: Error: Could not open codec [av1_vaapi]: Function not implemented
[2026-05-01 17:40:45.356]: Info: Screencasting with KMS
[2026-05-01 17:40:45.356]: Info: /dev/dri/card2 -> amdgpu
[2026-05-01 17:40:45.356]: Info: Found monitor for DRM screencasting
[2026-05-01 17:40:45.356]: Info: Found connector ID [377]
[2026-05-01 17:40:45.356]: Info: Found cursor plane [360]
[2026-05-01 17:40:45.360]: Info: Creating encoder [hevc_vaapi]
[2026-05-01 17:40:45.360]: Info: Color coding: SDR (Rec. 709)
[2026-05-01 17:40:45.360]: Info: Color depth: 10-bit
[2026-05-01 17:40:45.360]: Info: Color range: JPEG
[2026-05-01 17:40:45.369]: Info: vaapi vendor: Mesa Gallium driver 26.0.6-arch2.2 for AMD Ryzen 7 7800X3D 8-Core Processor (radeonsi, raphael_mendocino, ACO, DRM 3.64, 7.0.3-arch1-1)
[2026-05-01 17:40:45.369]: Info: Streaming bitrate is 1000000
[2026-05-01 17:40:45.369]: Info: Using normal encoding mode
[2026-05-01 17:40:45.369]: Info: Using default rate control
[2026-05-01 17:40:45.380]: Info: // Testing for available encoders, this may generate errors. You can safely ignore those errors. //
[2026-05-01 17:40:45.381]: Info: 
[2026-05-01 17:40:45.381]: Info: // Ignore any errors mentioned above, they are not relevant. //
[2026-05-01 17:40:45.381]: Info: 
[2026-05-01 17:40:45.381]: Info: Found H.264 encoder: h264_vaapi [vaapi]
[2026-05-01 17:40:45.381]: Info: Found HEVC encoder: hevc_vaapi [vaapi]
[2026-05-01 17:40:45.381]: Info: Starting system tray
[2026-05-01 17:40:45.382]: Info: Adding avahi service alberto-equipo
[2026-05-01 17:40:45.383]: Info: Configuration UI available at [https://localhost:47990]

(sunshine:17964): libayatana-appindicator-WARNING **: 17:40:45.400: libayatana-appindicator is deprecated. Please use libayatana-appindicator-glib in newly written code.
[2026-05-01 17:40:45.401]: Info: System tray created
[2026-05-01 17:40:45.401]: Info: Starting main loop
[2026-05-01 17:40:46.331]: Info: Avahi service alberto-equipo successfully established.
[2026-05-01 17:40:53.404]: Error: Unknown status

Regards!

### Host Operating System

Docker

### Operating System Version

archlinux

### Architecture

amd64/x86_64

### Package

Linux - LizardByte/pacman-repo

### GPU Type

AMD

### GPU Model

AMD Ryzen 7 7800X3D 8-Core Processor (radeonsi, raphael_mendocino, ACO, DRM 3.64, 7.0.3-arch1-1)

### GPU Driver/Mesa Version

26

### Capture Method

KMS (Linux)

### Apps

```json

```

### Log output

```shell

```

**Comment by quietvoid** [comment]
Same for me regardless of encoder, even software.
Just a lot of spam from https://github.com/LizardByte/Sunshine/blob/bdef150c6b3341cdd3048795c37257161d8afff7/src/platform/linux/kmsgrab.cpp#L1330

**Comment by paju1986** [comment]
I have tried capturing on X11 and wayland with the same result, also tried changing encoder to software instead of vaapi with same result

**Comment by TheFaux** [comment]
Not a black screen for me but veeery choppy, I changed nothing about my connection.

**Comment by TheRC51** [comment]
Is your issue present in the latest beta/pre-release?
This issue is present in the latest pre-release

Host Operating System
CachyOS

Operating System Version
archlinux

Architecture
amd64/x86_64

Package
Linux - LizardByte/pacman-repo

GPU Type
AMD

GPU Model
9070XT

GPU Driver/Mesa Version
26.0.6

Capture Method
KMS (Linux)

Having the same issue with kernel 7.0. Tried x11, different encoders, different devices, ect. Switched to 6.18 LTS kernel and everything works as expected.

**Comment by petronio** [comment]
Just chiming in that this is reproducible with Nvidia as well, so not GPU dependent. Reproducible with both Sunshine stable and git.

**Comment by TheFaux** [comment]
1. For some reason "stretch video to fullscreen" in Moonlight no longer works, it only stretches horizontally, even tho I'm pretty sure Moonlight hasn't had an update in a very long time.
2. Setting `capture = kms` in the config file is laggy, but `capture = x11` isn't. But X11 capture is annoying because of the constant cursor on the edge of the screen.
I'm sharing my fake second screen made by passing EDID in Kernel parameters, it was working perfectly before including stretch (for some reason I couldn't get it working with the Native Resolution option in Moonlight even tho they match, so I was using Stretch).
If I instead share my main screen, it's smooth with KMS or X11 Capture.

**Comment by psyke83** [comment]
Can someone post a log that also covers the connection attempt that produces the black screen?

**Comment by TheRC51** [comment]
> Can someone post a log that also covers the connection attempt that produces the black screen?

Hope this helps!

[sunshine.redacted.log](https://github.com/user-attachments/files/27384990/sunshine.redacted.log)

**Comment by psyke83** [comment]
@TheRC51 

Are you aware that vulkan is temporarily broken on master and your host is falling back to h264_vaapi? See #5076 and keep in mind that [v2026.427.203431](https://github.com/LizardByte/Sunshine/releases/tag/v2026.427.203431) is the most recent version that will work until the ffmpeg prebuilts are updated again.

If the problem is not due to the temporary vulkan breakage, it may help to try kwingrab or portalgrab to rule out if kmsgrab is the cause of breakage on kernel 7.0. I'm running kernel 7.0.3-zen1-2-zen, mesa 1:26.0.6-1 with a RX 6600, and kmsgrab, kwingrab & portalgrab all work OK with vaapi on current master.

**Comment by TheRC51** [comment]
Ah I did not! Thank you @psyke83, I can provide logs for a working session on the current version if that helps to cross reference? I assume that vulkan is still broken given the only thing I changed to get it to work was booting to the lts kernel.

EDIT:
Also noticed I made the mistake of using the aur for the sunshine-git package, I've now switched over to the official repo.

**Comment by paju1986** [comment]
Im on version 2025.924.154138 , x11 and kms dont work, also tried vaapi and software render and also give a black screen.

**Comment by TheFaux** [comment]
@TheRC51 What do you mean by official package? I'm on `sunshine-beta-bin`.

**Comment by TheRC51** [comment]
Installing via https://docs.lizardbyte.dev/projects/sunshine/latest/md_docs_2getting__started.html#install-prebuilt-packages

instead of the aur

**Comment by petronio** [comment]
Logs on a build of the current head ( 0899b3412b917a3c487582797368a6ba654b5fc4 ) using the PKGBUILD from LizardByte/pacman-repo

[sunshine-linux-6.19.2.log](https://github.com/user-attachments/files/27478472/sunshine-linux-6.19.2.log)
[sunshine-linux-7.0.3.log](https://github.com/user-attachments/files/27478471/sunshine-linux-7.0.3.log)

Both KMS and XDG Portal grab return black screens on 7.0.3 . Gnome's screen recorder is able to record the screen. Tried to test with ffmpeg's kmsgrab, but wasn't able to figure out the right incantation.

**Comment by njdom24** [comment]
I'm stuck on the latest release (v2025.924.154138) on NixOS, but I'm on kernel 7.0.3.
I can confirm `kmsgrab` still works fine there, at least.

**Comment by zer0bitzz** [comment]
Hey, I’m running into a very similar issue, so I’m sharing my setup and what I’ve tested in case it helps compare.

**Setup:**
- Sunshine version: 2026.507.123453  
- OS: Linux (KDE Plasma on Wayland) 
- Kernel: 7.0.3-arch1-2
- GPU: NVIDIA (NVENC available and working)  
- Compositor: Wayland (KWin)  
- PipeWire + XDG portal enabled  

**What I’ve tried:**

I initially tried using kwingrab, but it fails immediately with an “Unable to initialize capture method” error, so capture never actually starts. After that, I switched to kmsgrab, but this also fails in the same way, with the platform failing to initialize entirely. I then switched to portal capture instead. With portal mode, the capture system does initialize correctly and a PipeWire stream is created. In this configuration, NVENC encoders such as H.264 and HEVC are detected and selected successfully, and Moonlight is able to connect and start a streaming session. However, despite everything appearing to initialize correctly, the client only shows a black screen.

**What I found in logs:**

The logs show that NVENC encoders are successfully detected and initialized, and Sunshine is able to create a PipeWire stream through the portal capture backend. The correct monitor is detected and a streaming session is started without errors. Moonlight connects successfully and the session remains active for about 11 seconds and then disconnects. However, there is no visible video output being rendered to the client, resulting in a persistent black screen. AV1 encoding fails due to unsupported hardware, but H.264 and HEVC both initialize correctly and appear to be used.

**Behavior:**

Moonlight connects to the session successfully, but the stream only stays active for about ~10–11 seconds before disconnecting. During that time, the client shows a completely black screen with no visible video output. I’m not sure about audio behavior, since I didn’t hear any sound during the session. Input devices like gamepads are detected, but the session never becomes usable due to the lack of video and the early disconnect.

**Comment by dantmnf** [comment]
Same issue here, tcpdump shows many UDP bad length:
```
00:25:32.388651 IP 172.18.2.120.47998 > 172.18.2.242.63001: UDP, bad length 3120 > 1040
00:25:32.408633 IP 172.18.2.120.47998 > 172.18.2.242.63001: UDP, bad length 3120 > 1040
00:25:32.428603 IP 172.18.2.120.47998 > 172.18.2.242.63001: UDP, bad length 3120 > 1040
00:25:32.448568 IP 172.18.2.120.47998 > 172.18.2.242.63001: UDP, bad length 3120 > 1040
00:25:32.468535 IP 172.18.2.120.47998 > 172.18.2.242.63001: UDP, bad length 3120 > 1040
00:25:32.488510 IP 172.18.2.120.47998 > 172.18.2.242.63001: UDP, bad length 3120 > 1040
00:25:32.508496 IP 172.18.2.120.47998 > 172.18.2.242.63001: UDP, bad length 3120 > 1040
00:25:32.528468 IP 172.18.2.120.47998 > 172.18.2.242.63001: UDP, bad length 3120 > 1040
00:25:32.548430 IP 172.18.2.120.47998 > 172.18.2.242.63001: UDP, bad length 3120 > 1040
00:25:32.568402 IP 172.18.2.120.47998 > 172.18.2.242.63001: UDP, bad length 3120 > 1040
00:25:32.588386 IP 172.18.2.120.47998 > 172.18.2.242.63001: UDP, bad length 3120 > 1040
00:25:32.608371 IP 172.18.2.120.47998 > 172.18.2.242.63001: UDP, bad length 3120 > 1040
00:25:32.628433 IP 172.18.2.120.47998 > 172.18.2.242.63001: UDP, bad length 3120 > 1040
00:25:32.648401 IP 172.18.2.120.47998 > 172.18.2.242.63001: UDP, bad length 3120 > 1040
00:25:32.668370 IP 172.18.2.120.47998 > 172.18.2.242.63001: UDP, bad length 3120 > 1040
00:25:32.688349 IP 172.18.2.120.47998 > 172.18.2.242.63001: UDP, bad length 3120 > 1040
00:25:32.708336 IP 172.18.2.120.47998 > 172.18.2.242.63001: UDP, bad length 3120 > 1040
00:25:32.728307 IP 172.18.2.120.47998 > 172.18.2.242.63001: UDP, bad length 3120 > 1040
00:25:32.748269 IP 172.18.2.120.47998 > 172.18.2.242.63001: UDP, bad length 3120 > 1040
00:25:32.768242 IP 172.18.2.120.47998 > 172.18.2.242.63001: UDP, bad length 3120 > 1040
00:25:32.788219 IP 172.18.2.120.47998 > 172.18.2.242.63001: UDP, bad length 3120 > 1040
00:25:32.808204 IP 172.18.2.120.47998 > 172.18.2.242.63001: UDP, bad length 3120 > 1040
00:25:32.813780 IP 172.18.2.120.47998 > 172.18.2.242.63001: UDP, bad length 3120 > 1040
```

Disabling GSO fixed it for me:
```diff
diff --git a/src/platform/linux/misc.cpp b/src/platform/linux/misc.cpp
index 59d031d0..7a6a9b03 100644
--- a/src/platform/linux/misc.cpp
+++ b/src/platform/linux/misc.cpp
@@ -572,7 +572,7 @@ namespace platf {
 
     auto const max_iovs_per_msg = send_info.payload_buffers.size() + (send_info.headers ? 1 : 0);
 
-#ifdef UDP_SEGMENT
+#if 0
     {
       // UDP GSO on Linux currently only supports sending 64K or 64 segments at a time
       size_t seg_index = 0;
```

**Comment by EtherAura** [comment]
Confirming on Gentoo / NVIDIA the `#ifdef UDP_SEGMENT` > `#if 0` workaround at `src/platform/linux/misc.cpp:575` fully resolves the black screen issue.

Setup

- Gentoo Linux, kernel 7.0.5-gentoo-dist
- Intel i9-12900K + NVIDIA RTX 3070 Ti - single display attached to NVIDIA card, iGPU enabled but not in use, no PRIME
- NVIDIA open kernel module 595.58.03
- KDE Plasma 6.6.4 / KWin Wayland (PipeWire 1.4.10, kpipewire 6.6.4, Mesa 26.0.5)
- Sunshine built from current master via local Gentoo overlay; this `UDP_SEGMENT` workaround is the only change to the streaming/capture/network path

**Comment by Kishi85** [comment]
Does running `ethtool -K <interface> gso off` as root also fix the issue? Without patching sunshine source ofc

**Comment by EtherAura** [comment]
` ethtool -K <iface> gso off `is not sufficient. Reverted my Sunshine to the unpatched build, disabled GSO on both my LAN bridge and its physical slave. Reconnected from Moonlight and still got a black screen.

**Comment by psyke83** [comment]
The code being disabled is also related to scatter-gather. It might be helpful to share logs of `ethtool -k <dev>`, and using that output, ensure that all gso, gro and scatter-gather related offloading is disabled as a troubleshooting measure to see if one specific offload method is at fault. We also need to determine if this is truly an issue that needs fixing in Sunshine rather than in the kernel (I couldn't reproduce this issue on a wired host running kernel 7.0).

Edit: don't forget to restart Sunshine after changing any settings via ethtool to ensure that the network capabilities are reprobed/reinitialized in Sunshine itself.

**Comment by Kishi85** [comment]
> The code being disabled is also related to scatter-gather. It might be helpful to share logs of `ethtool -k <dev>`, and using that output, ensure that all gso, gro and scatter-gather related offloading is disabled as a troubleshooting measure to see if one specific offload method is at fault. We also need to determine if this is truly an issue that needs fixing in Sunshine rather than in the kernel (I couldn't reproduce this issue on a wired host running kernel 7.0).
> 
> Edit: don't forget to restart Sunshine after changing any settings via ethtool to ensure that the network capabilities are reprobed/reinitialized in Sunshine itself.

So checking if it works with `ethtool -K <interface> gso off gro off sg off` might do the trick. If it doesn't try disabling any enabled offloading shown by `ethtool -k <interface>` (also share those logs as already requested) and work out which specific offloading (or combination thereof) breaks Sunshine.

Since offloading is a network driver specific thing (likely the reason why I also cannot reproduce this with any of my systems) it would also be good to know what kind of network driver is used here as the issues might be related to changes/regressions from 6.19.x to 7.0.x in that/those specific driver(s).

**Comment by dantmnf** [comment]
> So checking if it works with ethtool -K <interface> gso off gro off sg off might do the trick

I can't touch my host PC at the moment, will check it days later.

> it would also be good to know what kind of network driver is used here

The faulting host is using a Mellanox NIC with in-tree mlx5 driver, but I don't think this could be a common cause.

Not reproducible on another laptop with same kernel/software version over Wi-Fi.

**Comment by quietvoid** [comment]
Curious that you mention that because I also  use `mlx5_core` but I haven't tried on another host.

**Comment by Kishi85** [comment]
If it's two mlx5 cases now then this could be the start of a pattern. There's quite some changes in the mlx5* driver from 6.19 to 7.0 but I'm no expert on the matter so here's just the grepped list from the 7.0 changelog:
```
      net/mlx5: Fix switchdev mode rollback in case of failure
      net/mlx5: Avoid "No data available" when FW version queries fail
      net/mlx5: lag: Check for LAG device before creating debugfs
      net/mlx5e: Fix race condition during IPSec ESN update
      net/mlx5e: Prevent concurrent access to IPSec ASO context
      net/mlx5: qos: Restrict RTNL area to avoid a lock cycle
      net/mlx5e: Fix "scheduling while atomic" in IPsec MAC address query
      net/mlx5: Fix missing devlink lock in SRIOV enable error path
      net/mlx5: E-switch, Clear legacy flag when moving to switchdev
      net/mlx5: LAG, disable MPESW in lag_disable_change()
      net/mlx5: DR, Fix circular locking dependency in dump
      net/mlx5e: Use unsigned for mlx5e_get_max_num_channels
      net/mlx5e: Fix deadlocks between devlink and netdev instance locks
      net/mlx5e: MACsec, add ASO poll loop in macsec_aso_set_arm_event
      net/mlx5: Fix misidentification of write combining CQE during poll loop
      net/mlx5e: Fix misidentification of ASO CQE during poll loop
      net/mlx5: Fix multiport device check over light SFs
      net/mlx5e: XSK, Fix unintended ICOSQ change
      net/mlx5: Add IFC bits for extended ETS rate limit bandwidth value
      net/mlx5: Add support for querying bond speed
      net/mlx5: Handle port and vport speed change events in MPESW
      net/mlx5: Propagate LAG effective max_tx_speed to vports
      net/mlx5: Add max_tx_speed and its CAP bit to IFC
```
If I had the issue I'd likely do a git bisect compiling the kernel myself and try to find the offending commit from the list: https://github.com/torvalds/linux/commits/master/drivers/net/ethernet/mellanox/mlx5?since=2026-02-08&until=2026-04-13

NIC-Offloading is always hardware specific so I wouldn't be surprised to see only one or a few drivers break. 
To work around try disabling offloading and see if that helps as suggested before.

**Comment by EtherAura** [comment]
Ran the full sweep matrix on my Mellanox (!) host per @psyke83 / @Kishi85's suggestions, restarting Sunshine between each ethtool change. I was able to pinpoint the specific broken offload path.

Host:

```text
NIC: Mellanox ConnectX
Driver: mlx5_core 7.0.5
Firmware: 14.32.1010
Kernel: Linux 7.0.5
Sunshine: current master
UDP_SEGMENT source patch NOT applied for this test
```

First test was:

```bash
sudo ethtool -K <iface> gso off gro off sg off
```

On mlx5_core, this *does not* disable `tx-udp-segmentation`.

Actual changes:

```text
tx-scatter-gather: off
tx-scatter-gather-fraglist: off
tx-generic-segmentation: off
rx-gro: off
tx-tcp-segmentation: off [not requested]
tx-tcp-ecn-segmentation: off [not requested]
tx-tcp-mangleid-segmentation: off [not requested]
tx-tcp6-segmentation: off [not requested]
```

Notice there's still no change to `tx-udp-segmentation`:

```bash
ethtool -k <iface> | grep -E 'scatter-gather|segmentation|receive-offload'
```

```text
scatter-gather: off
        tx-scatter-gather: off
        tx-scatter-gather-fraglist: off
tcp-segmentation-offload: off
generic-segmentation-offload: off
generic-receive-offload: off
tx-udp-segmentation: on
```

tcpdump during a Moonlight attempt still showed the giant GSO-style UDP packets:

```text
08:12:22.803387 IP 192.168.0.12.47998 > 192.168.0.150.53481: UDP, length 60544
08:12:22.803424 IP 192.168.0.12.47998 > 192.168.0.150.53481: UDP, length 4224
08:12:22.803433 IP 192.168.0.12.47998 > 192.168.0.150.53481: UDP, length 60544
08:12:22.803471 IP 192.168.0.12.47998 > 192.168.0.150.53481: UDP, length 4224
```

Result was still a black screen.

Then I tried disabling only UDP segmentation offload directly:

```bash
sudo ethtool -K <iface> tx-udp-segmentation off
```

That immediately changed behavior.

```text
tx-udp-segmentation: off
```

With everything else still enabled:

```text
scatter-gather: on
        tx-scatter-gather: on
        tx-scatter-gather-fraglist: on
tcp-segmentation-offload: on
generic-segmentation-offload: on
generic-receive-offload: on
tx-udp-segmentation: off
```

tcpdump now showed properly segmented MTU-sized packets:

```text
08:13:01.173948 IP 192.168.0.12.47998 > 192.168.0.150.40535: UDP, length 1408
08:13:01.173956 IP 192.168.0.12.47998 > 192.168.0.150.40535: UDP, length 1408
08:13:01.173957 IP 192.168.0.12.47998 > 192.168.0.150.40535: UDP, length 1408
08:13:01.173958 IP 192.168.0.12.47998 > 192.168.0.150.40535: UDP, length 1408
```

And video worked immediately.

I also tried the “disable literally everything” route, but on mlx5_core that seemed to break the bridge entirely once scatter-gather + TSO were both disabled. No packets captured at all during the Moonlight attempt, so I restored settings afterward.

So at least on mlx5_core, `tx-udp-segmentation` is independent from the generic `gso/gro/sg` flags. That explains why the earlier suggested combinations didn’t actually gate the broken codepath.

The working workaround for me is simply:

```bash
sudo ethtool -K <iface> tx-udp-segmentation off
```

If you're bridged, apply it to both the bridge and the physical slave interface.

This is a lot cleaner than carrying the Sunshine source patch around since it's just a one-line ethtool call and no rebuild.

Given that @dantmnf and @quietvoid are also on mlx5_core, this is looking more like a Mellanox driver issue than a generic kernel UDP regression. Feels like the real fix probably belongs upstream in mlx5_core.

**Comment by petronio** [comment]
Also on mlx5_core, with a ConnectX-4 Lx. Though for me disabling scatter-gather alone on the physical interface does fix the issue. Just tested scatter-gather on + tx-udp-segmentation off and that works as well. @EtherAura could you test again with scatter-gather off + tx-udp-segmentation on ?

```
Features for enp5s0f1np1:
rx-checksumming: on
tx-checksumming: on
        tx-checksum-ipv4: off [fixed]
        tx-checksum-ip-generic: on
        tx-checksum-ipv6: off [fixed]
        tx-checksum-fcoe-crc: off [fixed]
        tx-checksum-sctp: off [fixed]
scatter-gather: off
        tx-scatter-gather: off
        tx-scatter-gather-fraglist: off [fixed]
tcp-segmentation-offload: off
        tx-tcp-segmentation: off [requested on]
        tx-tcp-ecn-segmentation: off [fixed]
        tx-tcp-mangleid-segmentation: off
        tx-tcp6-segmentation: off [requested on]
        tx-tcp-accecn-segmentation: off [fixed]
generic-segmentation-offload: off [requested on]
generic-receive-offload: on
large-receive-offload: off
rx-vlan-offload: on
tx-vlan-offload: on
ntuple-filters: off
receive-hashing: on
highdma: on [fixed]
rx-vlan-filter: on
vlan-challenged: off [fixed]
tx-gso-robust: off [fixed]
tx-fcoe-segmentation: off [fixed]
tx-gre-segmentation: on
tx-gre-csum-segmentation: on
tx-ipxip4-segmentation: off [fixed]
tx-ipxip6-segmentation: off [fixed]
tx-udp_tnl-segmentation: on
tx-udp_tnl-csum-segmentation: on
tx-gso-partial: on
tx-tunnel-remcsum-segmentation: off [fixed]
tx-sctp-segmentation: off [fixed]
tx-esp-segmentation: off [fixed]
tx-udp-segmentation: on
tx-gso-list: off [fixed]
tx-nocache-copy: off
loopback: off [fixed]
rx-fcs: off
rx-all: off
tx-vlan-stag-hw-insert: on
rx-vlan-stag-hw-parse: off [fixed]
rx-vlan-stag-filter: on [fixed]
l2-fwd-offload: off [fixed]
hw-tc-offload: off
esp-hw-offload: off [fixed]
esp-tx-csum-hw-offload: off [fixed]
rx-udp_tunnel-port-offload: on
tls-hw-tx-offload: off [fixed]
tls-hw-rx-offload: off [fixed]
rx-gro-hw: off [fixed]
tls-hw-record: off [fixed]
rx-gro-list: off
macsec-hw-offload: on
rx-udp-gro-forwarding: on
hsr-tag-ins-offload: off [fixed]
hsr-tag-rm-offload: off [fixed]
hsr-fwd-offload: off [fixed]
hsr-dup-offload: off [fixed]

**Comment by EtherAura** [comment]
Confirmed @petronio's finding on bridged mlx5.

I re-ran testing with only `sg off` applied to the physical slave (`enp5s0f1np1`), leaving the bridge untouched and keeping `tx-udp-segmentation` enabled everywhere.

After the change on the slave:

```bash
sudo ethtool -K enp5s0f1np1 sg off
```

Actual changes:

```text
tx-scatter-gather: off
tx-generic-segmentation: off [not requested]
tx-tcp-segmentation: off [not requested]
tx-tcp-mangleid-segmentation: off [not requested]
tx-tcp6-segmentation: off [not requested]
```

Resulting state on the slave:

```bash
ethtool -k enp5s0f1np1 | grep -E '^scatter-gather|^generic-segmentation|^generic-receive|^tcp-segmentation|^tx-udp-segmentation'
```

```text
scatter-gather: off
tcp-segmentation-offload: off
generic-segmentation-offload: off [requested on]
generic-receive-offload: on
tx-udp-segmentation: on
```

Meanwhile the bridge (`UMN`) kept all defaults:

```text
scatter-gather: on
generic-segmentation-offload: on
tx-udp-segmentation: on
```

Moonlight video worked normally.

One interesting detail from the packet capture: tcpdump on the bridge still showed the giant 60544-byte UDP GSO superpackets even while video was working:

```text
08:41:41.361337 IP 192.168.0.12.47998 > 192.168.0.150.40405: UDP, length 60544
08:41:41.361395 IP 192.168.0.12.47998 > 192.168.0.150.40405: UDP, length 4224
08:41:41.361406 IP 192.168.0.12.47998 > 192.168.0.150.40405: UDP, length 60544
08:41:41.361460 IP 192.168.0.12.47998 > 192.168.0.150.40405: UDP, length 4224
```

That actually makes sense. With `sg off` on the slave, the kernel is still producing UDP_SEGMENT GSO packets into the bridge, but the device can no longer accept the scatter-gather DMA path. The stack falls back to software segmentation at NIC egress, so the actual wire packets end up MTU-sized and Moonlight works.

So on mlx5_core, both workarounds avoid the issue, but for different reasons:

```bash
sudo ethtool -K <slave> sg off
```

Kernel still generates UDP_SEGMENT GSO packets, but the SG-backed hardware TX path becomes unusable, forcing soft segmentation at NIC egress.

vs

```bash
sudo ethtool -K <bridge> <slave> tx-udp-segmentation off
```

Kernel never attempts UDP GSO hardware offload in the first place, so segmentation happens earlier in software at the UDP layer. tcpdump immediately shows normal 1408-byte packets.

That narrows the bug down pretty sharply: it looks specific to the combined SG + UDP_SEGMENT hardware TX path in mlx5_core. Disabling either side of that path avoids the failure.

Per @Kishi85's earlier suggestion, the likely bisect range is mlx5 changes somewhere between 6.19 and 7.0.

**Comment by paju1986** [comment]
sorry, im not very technical, is it a kernel bug?

**Comment by EtherAura** [comment]
Yes, it's most likely a kernel bug in the `mlx5_core` network driver (the one that runs Mellanox/ConnectX cards). 

Something changed between 6.19 and 7 that made one of the driver's network-offload features misbehave when Sunshine sends video. The bug does not appear to be in Sunshine itself.

**Comment by paju1986** [comment]
how can i know what network driver im using? (to confirm)

**Comment by EtherAura** [comment]
@paju1986  Two quick commands.

First, find the interface that actually has your LAN IP assigned to it:

```bash
ip -br -4 addr
```

Look for the interface with your local network IP on it (not `lo`, not `127.x.x.x`).

Then run:

```bash
ethtool -i <iface>
```

Replace `<iface>` with whatever interface name you found (`eno1`, `enp4s0`, etc.).

Look for:

```text
driver: <name>
```
If your driver also shows `mlx5_core`, there's a good chance the command below will fix the Moonlight black screen issue:

```bash
sudo ethtool -K <iface> tx-udp-segmentation off
```

**Comment by iNeXcf** [comment]
Confirming this also affects non-Mellanox hardware. Same kernel 7.x regression with tx-udp-segmentation = on. Fix is the same:

NIC: Aquantia AQC113CS (10G)
Driver: atlantic
Module: not mlx5_core — so the kernel bug is in the common network stack, not a single driver
Fix: sudo ethtool -K <iface> tx-udp-segmentation off

After disabling, Sunshine KMS capture works normally on kernel 7.0.3 . So this isn't limited to mlx5_core — it's a broader kernel 7.x UDP segmentation regression.

**Comment by paju1986** [comment]
thanks, looks like im not using mlx5 

this is my log (im currently on kernel 6.18LTS): 

[alberto@alberto-equipo ComfyUI]$ ethtool -i enp13s0
driver: atlantic
version: 6.18.28-1-lts
firmware-version: 1.5.42
expansion-rom-version: 
bus-info: 0000:0d:00.0
supports-statistics: yes
supports-test: no
supports-eeprom-access: no
supports-register-dump: no
supports-priv-flags: yes

**Comment by Kishi85** [comment]
Looks like someone is already working on this with people from the kernel mailing list (~at least for aquantia~):
https://lore.kernel.org/all/6c3fb15e-711d-4b8d-b152-e03d9b05293f@linux.dev/

EDIT: The fix from the mailinglist thread is in net/ipv4/udp_offload.c (therefore driver independent).

**Comment by zer0bitzz** [comment]
Thank you @EtherAura for the instructions!  I can confirm that running sudo ethtool -K enp2s0 tx-udp-segmentation off fixed the issue for me on Arch Linux. My Nvidia Shield is now able to connect to my desktop normally again without the black screen.

My network card is a ASUS ROG Areion 10G and here are more detailed info about the drivers:

[zer0bitz@archlinux ~]$ ethtool -i enp2s0
driver: atlantic
version: 7.0.3-arch1-2
firmware-version: 4.2.37
expansion-rom-version: 
bus-info: 0000:02:00.0
supports-statistics: yes
supports-test: no
supports-eeprom-access: no
supports-register-dump: yes
supports-priv-flags: yes

**Comment by Kishi85** [comment]
### TL;DR
This is an upstream issue in linux kernel 7.0 for (multiple) network drivers that support udp segmentation offloading. 
**It is not a Sunshine issue.**

Upstream issue with (potential) patches can be found here: https://lore.kernel.org/all/6c3fb15e-711d-4b8d-b152-e03d9b05293f@linux.dev/

If you need a workaround use the following found by @EtherAura: `sudo ethtool -K <iface> tx-udp-segmentation off` to disable udp segment offloading.

**Comment by Mr-Zoner** [comment]
I have three computers all on Ubuntu 26.04.  All on 7.0 kernel.   A laptop, a gaming pc,and an old workstation.   Clients are all moonlight, on the same hardware + a steamdeck.

The laptop always streamed fine with the new Sunshine .deb's for 26.04
The gaming PC and workstation always had awas always a black screen or a no video error eventually.  Both of them are now working with 'sudo ethtool -K <iface> tx-udp-segmentation off' applied.   One of my tests a while back was to run moonlight on localhost and those worked which I found odd at the time as I thought it was some kind of capture problem etc.

- Framework 16 laptop with Radeon RX7700 and an aftermarket Intel AX210 wifi card replacing the factory card.
- AMD 7850X3D on Asus ProArt X670, Geforce 4090, NVIDIA drivers,  onboard 10Gbit AQtion AQC113CS NIC
- AMD Threadripper 3990 on Asus Zenith Extreme 2, Radeon 7900XTX , onboard 10Gbit AQtion AQC107 NIC
- Home LAN switch and wifi APs are 10Gbit all Ubiuqiti hardware aside from an OpenWRT router.

**Comment by 7tg** [comment]
Confirming the fix on AMD + CachyOS.

**Host:**
- CachyOS, kernel 7.0.10-1-cachyos
- AMD Radeon RX 9070 XT, Mesa 26.1.1
- KDE Plasma / KWin Wayland, capture=kwin, encoder=vaapi (h264/hevc)
- Sunshine 2026.516.143833

**Client:** Xbox via Moonlight (UWP), LAN — reproduced on both wired and Wi-Fi.

**Symptoms:** Moonlight reported ~500ms network latency on LAN; sessions terminated after ~10s with `Ping Timeout` in Sunshine logs; occasional `Skipping FEC for abnormally large encoded frame (needed 5 FEC blocks)`. No black screen on this client — it just refused to stay connected.

**Fix:** `sudo ethtool -K <iface> tx-udp-segmentation off` — immediate fix. Latency dropped to normal, sessions stable.

Thanks @EtherAura @Kishi85 for the diagnosis.
